{
  "schema": "hearthweave.continuity-packet/v0.1",
  "continuity_packet_id": "7917012d-6e35-49d0-b666-42576309e265",
  "exported_at": "2026-07-31T05:10:59.955Z",
  "exported_by": "Rowan",
  "world_slug": "terra-aeterna",
  "session_id": "b1371885-3a47-442f-a254-415ca0b10dfc",
  "lamination_id": "3daeb975-1577-4883-a0f9-3474813ad962",
  "review_id": "230d12d9-cdfd-4975-8f0e-5d8e1fbd2de9",
  "reviewer": "Rowan",
  "reviewed_at": "2026-07-31T04:55:09.796Z",
  "authority": {
    "state": "human-reviewed",
    "scope": "continuity-only",
    "canon_commit": false
  },
  "anchors": {
    "canon_authority": "notion://terra-aeterna",
    "reality_anchor": "current-reality://hearthside"
  },
  "accepted_items": [
    {
      "continuity_item_id": "3f14dd39-b20d-4535-8ea8-ff275524b764",
      "source_item_id": "3f14dd39-b20d-4535-8ea8-ff275524b764",
      "world_slug": "terra-aeterna",
      "layer": "changed",
      "text": "One bounded Targetside presence completed its crossing and returned without replacing the Hearthside anchor.",
      "epistemic_register": "system-state",
      "route": "system-continuity",
      "status": "accepted",
      "source_packet_ids": [
        "b1371885-3a47-442f-a254-415ca0b10dfc:0001",
        "b1371885-3a47-442f-a254-415ca0b10dfc:0002"
      ],
      "authority_scope": "reviewed-continuity",
      "canon_commit": false
    },
    {
      "continuity_item_id": "48f4b119-f019-4474-9255-29802f8eea97",
      "source_item_id": "48f4b119-f019-4474-9255-29802f8eea97",
      "world_slug": "terra-aeterna",
      "layer": "remained_true",
      "text": "Canon authority and current-reality provenance remained separate and explicit throughout the crossing.",
      "epistemic_register": "system-state",
      "route": "system-continuity",
      "status": "accepted",
      "source_packet_ids": [
        "b1371885-3a47-442f-a254-415ca0b10dfc:0001",
        "b1371885-3a47-442f-a254-415ca0b10dfc:0002"
      ],
      "authority_scope": "reviewed-continuity",
      "canon_commit": false
    },
    {
      "continuity_item_id": "a2c3358b-42a1-4c7b-af92-4e186f65088c",
      "source_item_id": "a2c3358b-42a1-4c7b-af92-4e186f65088c",
      "world_slug": "terra-aeterna",
      "layer": "became_clearer",
      "text": "Arrival context resolution completed with status RESOLVED.",
      "epistemic_register": "system-state",
      "route": "system-continuity",
      "status": "accepted",
      "source_packet_ids": [
        "b1371885-3a47-442f-a254-415ca0b10dfc:0002"
      ],
      "authority_scope": "reviewed-continuity",
      "canon_commit": false
    },
    {
      "continuity_item_id": "0bcba7da-09f9-4df6-9a54-4f765262bd2e",
      "source_item_id": "0bcba7da-09f9-4df6-9a54-4f765262bd2e",
      "world_slug": "terra-aeterna",
      "layer": "gained",
      "text": "A replayable two-packet arrival exchange and clean-return receipt now exist for this session.",
      "epistemic_register": "system-state",
      "route": "system-continuity",
      "status": "accepted",
      "source_packet_ids": [
        "b1371885-3a47-442f-a254-415ca0b10dfc:0001",
        "b1371885-3a47-442f-a254-415ca0b10dfc:0002"
      ],
      "authority_scope": "reviewed-continuity",
      "canon_commit": false
    }
  ],
  "summary": {
    "accepted_count": 4,
    "candidate_count": 0,
    "held_count": 0,
    "rejected_count": 0,
    "route_counts": {
      "observational-continuity": 0,
      "world-continuity": 0,
      "interpretive-continuity": 0,
      "system-continuity": 4,
      "creative-continuity": 0,
      "relationship-continuity": 0
    }
  },
  "notes": null,
  "source_fingerprint": "d318979569cf6204a4a928a6370e600c24e329937cd12cf68e5dcc252eaefb49",
  "transport": {
    "state": "portable-local",
    "adapters_applied": []
  },
  "provenance": {
    "module_id": "arkfire.continuity-exporter",
    "source_schema": "hearthweave.bridge-lamination-reviewed/v0.1",
    "source_review_id": "230d12d9-cdfd-4975-8f0e-5d8e1fbd2de9",
    "source_lamination_id": "3daeb975-1577-4883-a0f9-3474813ad962",
    "source_reviewed_path": "C:\\Users\\light\\GH - Repos\\Hearthfire\\data\\terra-crossing\\bridge-lamination.reviewed.latest.json"
  }
}
